{
  "$schema": "http://json-schema.org/draft-07/schema#",
  "title": "Gate Authoring Draft",
  "description": "Adapter input shape only; resource validity is decided by resource_manager. Nested definitions pass through unchanged.",
  "type": "object",
  "properties": {
    "id": {
      "type": "string",
      "description": "Stable authored resource identifier"
    },
    "name": {
      "type": "string",
      "description": "Human-readable resource name"
    },
    "type": {
      "type": "string",
      "description": "[Gate] Gate type: validation (pass/fail) or guidance (advisory). Default: validation. Writes the gate.yaml key 'type'."
    },
    "gate_type": {
      "type": "string",
      "description": "[Gate] Gate classification. Default: custom. Writes the gate.yaml key 'gate_type'; 'framework' marks a gate that requires an active framework and is filtered out when framework gates are disabled."
    },
    "description": {
      "type": "string",
      "description": "What the resource does and when to use it"
    },
    "guidance": {
      "type": "string",
      "description": "[Gate] Gate guidance content - the criteria or instructions."
    },
    "pass_criteria": {
      "type": "array",
      "description": "[Gate] Structured pass criteria definitions. Each entry is an object, not a bare string: optional type (inline_guidance|framework_compliance|shell_verify|script_tool) plus the fields that type reads — framework compliance's framework/min_compliance_score/severity/quality_indicators, shell verification's shell_command/shell_timeout/shell_working_dir/shell_env/shell_max_attempts/shell_preset/shell_stdin_source/shell_response_env_var, or script tool's script_tool_id/script_tool_input/script_tool_timeout/script_tool_working_dir. Supports canonical semantic_evaluation criteria with id, target, question, evidence_requirements, result, acceptance and allow_not_applicable; server validation owns nested shapes.",
      "items": {}
    },
    "activation": {
      "type": "object",
      "description": "[Gate] Activation rules: prompt_categories, framework_context (framework ids), explicit_request (boolean), artifacts (artifact kinds)."
    },
    "retry_config": {
      "type": "object",
      "description": "[Gate] Retry configuration: max_attempts (positive integer), improvement_hints and preserve_context (booleans)."
    },
    "subject": {
      "type": "string",
      "description": "[Gate] Free kebab-case tag naming what this gate reminds about (e.g. 'code-quality'). An installation's `gates.harnessCovers` (config.jsonc, or config.json) suppresses reminder-tier gates whose subject it lists; check-tier gates (shell_verify, script_tool) are never suppressed. Lowercase letters, digits and hyphens only."
    },
    "severity": {
      "type": "string",
      "description": "[Gate] Severity for prioritization. Default: medium. Omitted on update, an existing gate keeps its current value."
    },
    "enforcement_mode": {
      "type": "string",
      "description": "[Gate] What a FAIL does: blocking holds the chain step, advisory advances and names the failure in the reply, informational advances silently. Absent, the gate holds a chain step. When a FAIL verdict names gates in per_gate, only those gates decide; otherwise the strictest gate on the step does."
    },
    "block_response_on_fail": {
      "type": "boolean",
      "description": "[Gate] Withhold the step output when this gate is marked FAIL, returning the gate review in its place. Writes the gate.yaml key 'blockResponseOnFail'. Omitted on update, an existing gate keeps its current value; send `false` to clear it."
    },
    "evaluation": {
      "type": "object",
      "description": "[Gate] Who reviews this gate: `mode: \"self\"` (the model that wrote the output) or `mode: \"judge\"` (a context-isolated reviewer that sees only the output and the criteria). `model` is a hint for which model the judge runs on; `strict` asks for failures first, and defaults to true under `judge`. Writes the gate.yaml key 'evaluation' whole, so a supplied block replaces the existing one. Omitted on update, an existing gate keeps its current block; send `{\"mode\": \"self\"}` to return the gate to self-review. An unrecognized key inside the block is refused by path."
    },
    "enforcementMode": {
      "type": "string",
      "description": "Legacy alias for enforcement_mode; canonical value wins when both are supplied"
    },
    "calibration_suite_id": {
      "type": "string",
      "description": "Opaque public calibration suite association; not a path or private-case lookup."
    }
  },
  "required": ["id", "name", "description"],
  "additionalProperties": false
}
