{
  "id": "content-structure",
  "name": "Content Structure Guidelines",
  "type": "validation",
  "description": "Ensures well-organized, readable content with clear structure",
  "guidance": "**Content Structure Guidelines:**\n- Use clear headings and subheadings (## and ###)\n- Organize content in logical sections\n- Include bullet points or numbered lists for clarity\n- Provide examples when explaining concepts\n- Maintain consistent tone and style\n- Ensure smooth transitions between sections\n- Include a summary or conclusion when appropriate",
  "pass_criteria": [
    {
      "type": "content_check",
      "min_length": 200,
      "required_patterns": [
        "##",
        "-",
        "example"
      ]
    },
    {
      "type": "pattern_check",
      "keyword_count": {
        "##": 2
      },
      "regex_patterns": [
        "^##\\s+.+$",
        "^\\s*[-*]\\s+.+"
      ]
    },
    {
      "type": "llm_self_check",
      "prompt_template": "structure_validation",
      "pass_threshold": 0.7
    }
  ],
  "retry_config": {
    "max_attempts": 2,
    "improvement_hints": true,
    "preserve_context": true
  },
  "activation": {
    "prompt_categories": ["documentation", "content_processing", "education"],
    "explicit_request": false,
    "framework_context": ["CAGEERF", "5W1H"]
  }
}